    1   0.000000 10.158.134.32 → 10.158.134.5 TCP 66 51392 → 54321 [SYN] Seq=0 Win=64240 Len=0 MSS=1460 WS=256 SACK_PERM
Frame 1: 66 bytes on wire (528 bits), 66 bytes captured (528 bits) on interface \Device\NPF_{06E76EDA-507E-41DF-9258-2F74B7137C90}, id 0
    Section number: 1
    Interface id: 0 (\Device\NPF_{06E76EDA-507E-41DF-9258-2F74B7137C90})
        Interface name: \Device\NPF_{06E76EDA-507E-41DF-9258-2F74B7137C90}
        Interface description: Ethernet
    Encapsulation type: Ethernet (1)
    Arrival Time: Jun  6, 2019 13:38:02.226113000 UTC
    [Time shift for this packet: 0.000000000 seconds]
    Epoch Time: 1559828282.226113000 seconds
    [Time delta from previous captured frame: 0.000000000 seconds]
    [Time delta from previous displayed frame: 0.000000000 seconds]
    [Time since reference or first frame: 0.000000000 seconds]
    Frame Number: 1
    Frame Length: 66 bytes (528 bits)
    Capture Length: 66 bytes (528 bits)
    [Frame is marked: False]
    [Frame is ignored: False]
    [Protocols in frame: eth:ethertype:ip:tcp]
Ethernet II, Src: Dell_55:40:83 (5c:26:0a:55:40:83), Dst: Dell_92:7c:f7 (d8:9e:f3:92:7c:f7)
    Destination: Dell_92:7c:f7 (d8:9e:f3:92:7c:f7)
        Address: Dell_92:7c:f7 (d8:9e:f3:92:7c:f7)
        .... ..0. .... .... .... .... = LG bit: Globally unique address (factory default)
        .... ...0 .... .... .... .... = IG bit: Individual address (unicast)
    Source: Dell_55:40:83 (5c:26:0a:55:40:83)
        Address: Dell_55:40:83 (5c:26:0a:55:40:83)
        .... ..0. .... .... .... .... = LG bit: Globally unique address (factory default)
        .... ...0 .... .... .... .... = IG bit: Individual address (unicast)
    Type: IPv4 (0x0800)
Internet Protocol Version 4, Src: 10.158.134.32, Dst: 10.158.134.5
    0100 .... = Version: 4
    .... 0101 = Header Length: 20 bytes (5)
    Differentiated Services Field: 0x00 (DSCP: CS0, ECN: Not-ECT)
        0000 00.. = Differentiated Services Codepoint: Default (0)
        .... ..00 = Explicit Congestion Notification: Not ECN-Capable Transport (0)
    Total Length: 52
    Identification: 0xe2e1 (58081)
    010. .... = Flags: 0x2, Don't fragment
        0... .... = Reserved bit: Not set
        .1.. .... = Don't fragment: Set
        ..0. .... = More fragments: Not set
    ...0 0000 0000 0000 = Fragment Offset: 0
    Time to Live: 128
    Protocol: TCP (6)
    Header Checksum: 0xf680 [validation disabled]
    [Header checksum status: Unverified]
    Source Address: 10.158.134.32
    Destination Address: 10.158.134.5
Transmission Control Protocol, Src Port: 51392, Dst Port: 54321, Seq: 0, Len: 0
    Source Port: 51392
    Destination Port: 54321
    [Stream index: 0]
    [Conversation completeness: Complete, WITH_DATA (31)]
    [TCP Segment Len: 0]
    Sequence Number: 0    (relative sequence number)
    Sequence Number (raw): 738756694
    [Next Sequence Number: 1    (relative sequence number)]
    Acknowledgment Number: 0
    Acknowledgment number (raw): 0
    1000 .... = Header Length: 32 bytes (8)
    Flags: 0x002 (SYN)
        000. .... .... = Reserved: Not set
        ...0 .... .... = Accurate ECN: Not set
        .... 0... .... = Congestion Window Reduced: Not set
        .... .0.. .... = ECN-Echo: Not set
        .... ..0. .... = Urgent: Not set
        .... ...0 .... = Acknowledgment: Not set
        .... .... 0... = Push: Not set
        .... .... .0.. = Reset: Not set
        .... .... ..1. = Syn: Set
            [Expert Info (Chat/Sequence): Connection establish request (SYN): server port 54321]
                [Connection establish request (SYN): server port 54321]
                [Severity level: Chat]
                [Group: Sequence]
        .... .... ...0 = Fin: Not set
        [TCP Flags: ··········S·]
    Window: 64240
    [Calculated window size: 64240]
    Checksum: 0x016d [unverified]
    [Checksum Status: Unverified]
    Urgent Pointer: 0
    Options: (12 bytes), Maximum segment size, No-Operation (NOP), Window scale, No-Operation (NOP), No-Operation (NOP), SACK permitted
        TCP Option - Maximum segment size: 1460 bytes
            Kind: Maximum Segment Size (2)
            Length: 4
            MSS Value: 1460
        TCP Option - No-Operation (NOP)
            Kind: No-Operation (1)
        TCP Option - Window scale: 8 (multiply by 256)
            Kind: Window Scale (3)
            Length: 3
            Shift count: 8
            [Multiplier: 256]
        TCP Option - No-Operation (NOP)
            Kind: No-Operation (1)
        TCP Option - No-Operation (NOP)
            Kind: No-Operation (1)
        TCP Option - SACK permitted
            Kind: SACK Permitted (4)
            Length: 2
    [Timestamps]
        [Time since first frame in this TCP stream: 0.000000000 seconds]
        [Time since previous frame in this TCP stream: 0.000000000 seconds]
This is Hello version 0.0.0, a Wireshark postdissector plugin prototype

    2   0.000106 10.158.134.5 → 10.158.134.32 TCP 66 54321 → 51392 [SYN, ACK] Seq=0 Ack=1 Win=65535 Len=0 MSS=1460 WS=256 SACK_PERM
Frame 2: 66 bytes on wire (528 bits), 66 bytes captured (528 bits) on interface \Device\NPF_{06E76EDA-507E-41DF-9258-2F74B7137C90}, id 0
    Section number: 1
    Interface id: 0 (\Device\NPF_{06E76EDA-507E-41DF-9258-2F74B7137C90})
        Interface name: \Device\NPF_{06E76EDA-507E-41DF-9258-2F74B7137C90}
        Interface description: Ethernet
    Encapsulation type: Ethernet (1)
    Arrival Time: Jun  6, 2019 13:38:02.226219000 UTC
    [Time shift for this packet: 0.000000000 seconds]
    Epoch Time: 1559828282.226219000 seconds
    [Time delta from previous captured frame: 0.000106000 seconds]
    [Time delta from previous displayed frame: 0.000106000 seconds]
    [Time since reference or first frame: 0.000106000 seconds]
    Frame Number: 2
    Frame Length: 66 bytes (528 bits)
    Capture Length: 66 bytes (528 bits)
    [Frame is marked: False]
    [Frame is ignored: False]
    [Protocols in frame: eth:ethertype:ip:tcp]
Ethernet II, Src: Dell_92:7c:f7 (d8:9e:f3:92:7c:f7), Dst: Dell_55:40:83 (5c:26:0a:55:40:83)
    Destination: Dell_55:40:83 (5c:26:0a:55:40:83)
        Address: Dell_55:40:83 (5c:26:0a:55:40:83)
        .... ..0. .... .... .... .... = LG bit: Globally unique address (factory default)
        .... ...0 .... .... .... .... = IG bit: Individual address (unicast)
    Source: Dell_92:7c:f7 (d8:9e:f3:92:7c:f7)
        Address: Dell_92:7c:f7 (d8:9e:f3:92:7c:f7)
        .... ..0. .... .... .... .... = LG bit: Globally unique address (factory default)
        .... ...0 .... .... .... .... = IG bit: Individual address (unicast)
    Type: IPv4 (0x0800)
Internet Protocol Version 4, Src: 10.158.134.5, Dst: 10.158.134.32
    0100 .... = Version: 4
    .... 0101 = Header Length: 20 bytes (5)
    Differentiated Services Field: 0x00 (DSCP: CS0, ECN: Not-ECT)
        0000 00.. = Differentiated Services Codepoint: Default (0)
        .... ..00 = Explicit Congestion Notification: Not ECN-Capable Transport (0)
    Total Length: 52
    Identification: 0x351a (13594)
    010. .... = Flags: 0x2, Don't fragment
        0... .... = Reserved bit: Not set
        .1.. .... = Don't fragment: Set
        ..0. .... = More fragments: Not set
    ...0 0000 0000 0000 = Fragment Offset: 0
    Time to Live: 128
    Protocol: TCP (6)
    Header Checksum: 0x0000 [validation disabled]
    [Header checksum status: Unverified]
    Source Address: 10.158.134.5
    Destination Address: 10.158.134.32
Transmission Control Protocol, Src Port: 54321, Dst Port: 51392, Seq: 0, Ack: 1, Len: 0
    Source Port: 54321
    Destination Port: 51392
    [Stream index: 0]
    [Conversation completeness: Complete, WITH_DATA (31)]
    [TCP Segment Len: 0]
    Sequence Number: 0    (relative sequence number)
    Sequence Number (raw): 1681547179
    [Next Sequence Number: 1    (relative sequence number)]
    Acknowledgment Number: 1    (relative ack number)
    Acknowledgment number (raw): 738756695
    1000 .... = Header Length: 32 bytes (8)
    Flags: 0x012 (SYN, ACK)
        000. .... .... = Reserved: Not set
        ...0 .... .... = Accurate ECN: Not set
        .... 0... .... = Congestion Window Reduced: Not set
        .... .0.. .... = ECN-Echo: Not set
        .... ..0. .... = Urgent: Not set
        .... ...1 .... = Acknowledgment: Set
        .... .... 0... = Push: Not set
        .... .... .0.. = Reset: Not set
        .... .... ..1. = Syn: Set
            [Expert Info (Chat/Sequence): Connection establish acknowledge (SYN+ACK): server port 54321]
                [Connection establish acknowledge (SYN+ACK): server port 54321]
                [Severity level: Chat]
                [Group: Sequence]
        .... .... ...0 = Fin: Not set
        [TCP Flags: ·······A··S·]
    Window: 65535
    [Calculated window size: 65535]
    Checksum: 0x2188 [unverified]
    [Checksum Status: Unverified]
    Urgent Pointer: 0
    Options: (12 bytes), Maximum segment size, No-Operation (NOP), Window scale, No-Operation (NOP), No-Operation (NOP), SACK permitted
        TCP Option - Maximum segment size: 1460 bytes
            Kind: Maximum Segment Size (2)
            Length: 4
            MSS Value: 1460
        TCP Option - No-Operation (NOP)
            Kind: No-Operation (1)
        TCP Option - Window scale: 8 (multiply by 256)
            Kind: Window Scale (3)
            Length: 3
            Shift count: 8
            [Multiplier: 256]
        TCP Option - No-Operation (NOP)
            Kind: No-Operation (1)
        TCP Option - No-Operation (NOP)
            Kind: No-Operation (1)
        TCP Option - SACK permitted
            Kind: SACK Permitted (4)
            Length: 2
    [Timestamps]
        [Time since first frame in this TCP stream: 0.000106000 seconds]
        [Time since previous frame in this TCP stream: 0.000106000 seconds]
    [SEQ/ACK analysis]
        [This is an ACK to the segment in frame: 1]
        [The RTT to ACK the segment was: 0.000106000 seconds]
        [iRTT: 0.000496000 seconds]
This is Hello version 0.0.0, a Wireshark postdissector plugin prototype

    3   0.000496 10.158.134.32 → 10.158.134.5 TCP 60 51392 → 54321 [ACK] Seq=1 Ack=1 Win=2102272 Len=0
Frame 3: 60 bytes on wire (480 bits), 60 bytes captured (480 bits) on interface \Device\NPF_{06E76EDA-507E-41DF-9258-2F74B7137C90}, id 0
    Section number: 1
    Interface id: 0 (\Device\NPF_{06E76EDA-507E-41DF-9258-2F74B7137C90})
        Interface name: \Device\NPF_{06E76EDA-507E-41DF-9258-2F74B7137C90}
        Interface description: Ethernet
    Encapsulation type: Ethernet (1)
    Arrival Time: Jun  6, 2019 13:38:02.226609000 UTC
    [Time shift for this packet: 0.000000000 seconds]
    Epoch Time: 1559828282.226609000 seconds
    [Time delta from previous captured frame: 0.000390000 seconds]
    [Time delta from previous displayed frame: 0.000390000 seconds]
    [Time since reference or first frame: 0.000496000 seconds]
    Frame Number: 3
    Frame Length: 60 bytes (480 bits)
    Capture Length: 60 bytes (480 bits)
    [Frame is marked: False]
    [Frame is ignored: False]
    [Protocols in frame: eth:ethertype:ip:tcp]
Ethernet II, Src: Dell_55:40:83 (5c:26:0a:55:40:83), Dst: Dell_92:7c:f7 (d8:9e:f3:92:7c:f7)
    Destination: Dell_92:7c:f7 (d8:9e:f3:92:7c:f7)
        Address: Dell_92:7c:f7 (d8:9e:f3:92:7c:f7)
        .... ..0. .... .... .... .... = LG bit: Globally unique address (factory default)
        .... ...0 .... .... .... .... = IG bit: Individual address (unicast)
    Source: Dell_55:40:83 (5c:26:0a:55:40:83)
        Address: Dell_55:40:83 (5c:26:0a:55:40:83)
        .... ..0. .... .... .... .... = LG bit: Globally unique address (factory default)
        .... ...0 .... .... .... .... = IG bit: Individual address (unicast)
    Type: IPv4 (0x0800)
    Padding: 000000000000
Internet Protocol Version 4, Src: 10.158.134.32, Dst: 10.158.134.5
    0100 .... = Version: 4
    .... 0101 = Header Length: 20 bytes (5)
    Differentiated Services Field: 0x00 (DSCP: CS0, ECN: Not-ECT)
        0000 00.. = Differentiated Services Codepoint: Default (0)
        .... ..00 = Explicit Congestion Notification: Not ECN-Capable Transport (0)
    Total Length: 40
    Identification: 0xe2e2 (58082)
    010. .... = Flags: 0x2, Don't fragment
        0... .... = Reserved bit: Not set
        .1.. .... = Don't fragment: Set
        ..0. .... = More fragments: Not set
    ...0 0000 0000 0000 = Fragment Offset: 0
    Time to Live: 128
    Protocol: TCP (6)
    Header Checksum: 0xf68b [validation disabled]
    [Header checksum status: Unverified]
    Source Address: 10.158.134.32
    Destination Address: 10.158.134.5
Transmission Control Protocol, Src Port: 51392, Dst Port: 54321, Seq: 1, Ack: 1, Len: 0
    Source Port: 51392
    Destination Port: 54321
    [Stream index: 0]
    [Conversation completeness: Complete, WITH_DATA (31)]
    [TCP Segment Len: 0]
    Sequence Number: 1    (relative sequence number)
    Sequence Number (raw): 738756695
    [Next Sequence Number: 1    (relative sequence number)]
    Acknowledgment Number: 1    (relative ack number)
    Acknowledgment number (raw): 1681547180
    0101 .... = Header Length: 20 bytes (5)
    Flags: 0x010 (ACK)
        000. .... .... = Reserved: Not set
        ...0 .... .... = Accurate ECN: Not set
        .... 0... .... = Congestion Window Reduced: Not set
        .... .0.. .... = ECN-Echo: Not set
        .... ..0. .... = Urgent: Not set
        .... ...1 .... = Acknowledgment: Set
        .... .... 0... = Push: Not set
        .... .... .0.. = Reset: Not set
        .... .... ..0. = Syn: Not set
        .... .... ...0 = Fin: Not set
        [TCP Flags: ·······A····]
    Window: 8212
    [Calculated window size: 2102272]
    [Window size scaling factor: 256]
    Checksum: 0x5926 [unverified]
    [Checksum Status: Unverified]
    Urgent Pointer: 0
    [Timestamps]
        [Time since first frame in this TCP stream: 0.000496000 seconds]
        [Time since previous frame in this TCP stream: 0.000390000 seconds]
    [SEQ/ACK analysis]
        [This is an ACK to the segment in frame: 2]
        [The RTT to ACK the segment was: 0.000390000 seconds]
        [iRTT: 0.000496000 seconds]
This is Hello version 0.0.0, a Wireshark postdissector plugin prototype

    4   5.567446 10.158.134.32 → 10.158.134.5 TCP 61 51392 → 54321 [PSH, ACK] Seq=1 Ack=1 Win=2102272 Len=7
Frame 4: 61 bytes on wire (488 bits), 61 bytes captured (488 bits) on interface \Device\NPF_{06E76EDA-507E-41DF-9258-2F74B7137C90}, id 0
    Section number: 1
    Interface id: 0 (\Device\NPF_{06E76EDA-507E-41DF-9258-2F74B7137C90})
        Interface name: \Device\NPF_{06E76EDA-507E-41DF-9258-2F74B7137C90}
        Interface description: Ethernet
    Encapsulation type: Ethernet (1)
    Arrival Time: Jun  6, 2019 13:38:07.793559000 UTC
    [Time shift for this packet: 0.000000000 seconds]
    Epoch Time: 1559828287.793559000 seconds
    [Time delta from previous captured frame: 5.566950000 seconds]
    [Time delta from previous displayed frame: 5.566950000 seconds]
    [Time since reference or first frame: 5.567446000 seconds]
    Frame Number: 4
    Frame Length: 61 bytes (488 bits)
    Capture Length: 61 bytes (488 bits)
    [Frame is marked: False]
    [Frame is ignored: False]
    [Protocols in frame: eth:ethertype:ip:tcp:data]
Ethernet II, Src: Dell_55:40:83 (5c:26:0a:55:40:83), Dst: Dell_92:7c:f7 (d8:9e:f3:92:7c:f7)
    Destination: Dell_92:7c:f7 (d8:9e:f3:92:7c:f7)
        Address: Dell_92:7c:f7 (d8:9e:f3:92:7c:f7)
        .... ..0. .... .... .... .... = LG bit: Globally unique address (factory default)
        .... ...0 .... .... .... .... = IG bit: Individual address (unicast)
    Source: Dell_55:40:83 (5c:26:0a:55:40:83)
        Address: Dell_55:40:83 (5c:26:0a:55:40:83)
        .... ..0. .... .... .... .... = LG bit: Globally unique address (factory default)
        .... ...0 .... .... .... .... = IG bit: Individual address (unicast)
    Type: IPv4 (0x0800)
Internet Protocol Version 4, Src: 10.158.134.32, Dst: 10.158.134.5
    0100 .... = Version: 4
    .... 0101 = Header Length: 20 bytes (5)
    Differentiated Services Field: 0x00 (DSCP: CS0, ECN: Not-ECT)
        0000 00.. = Differentiated Services Codepoint: Default (0)
        .... ..00 = Explicit Congestion Notification: Not ECN-Capable Transport (0)
    Total Length: 47
    Identification: 0xe2e3 (58083)
    010. .... = Flags: 0x2, Don't fragment
        0... .... = Reserved bit: Not set
        .1.. .... = Don't fragment: Set
        ..0. .... = More fragments: Not set
    ...0 0000 0000 0000 = Fragment Offset: 0
    Time to Live: 128
    Protocol: TCP (6)
    Header Checksum: 0xf683 [validation disabled]
    [Header checksum status: Unverified]
    Source Address: 10.158.134.32
    Destination Address: 10.158.134.5
Transmission Control Protocol, Src Port: 51392, Dst Port: 54321, Seq: 1, Ack: 1, Len: 7
    Source Port: 51392
    Destination Port: 54321
    [Stream index: 0]
    [Conversation completeness: Complete, WITH_DATA (31)]
    [TCP Segment Len: 7]
    Sequence Number: 1    (relative sequence number)
    Sequence Number (raw): 738756695
    [Next Sequence Number: 8    (relative sequence number)]
    Acknowledgment Number: 1    (relative ack number)
    Acknowledgment number (raw): 1681547180
    0101 .... = Header Length: 20 bytes (5)
    Flags: 0x018 (PSH, ACK)
        000. .... .... = Reserved: Not set
        ...0 .... .... = Accurate ECN: Not set
        .... 0... .... = Congestion Window Reduced: Not set
        .... .0.. .... = ECN-Echo: Not set
        .... ..0. .... = Urgent: Not set
        .... ...1 .... = Acknowledgment: Set
        .... .... 1... = Push: Set
        .... .... .0.. = Reset: Not set
        .... .... ..0. = Syn: Not set
        .... .... ...0 = Fin: Not set
        [TCP Flags: ·······AP···]
    Window: 8212
    [Calculated window size: 2102272]
    [Window size scaling factor: 256]
    Checksum: 0x717c [unverified]
    [Checksum Status: Unverified]
    Urgent Pointer: 0
    [Timestamps]
        [Time since first frame in this TCP stream: 5.567446000 seconds]
        [Time since previous frame in this TCP stream: 5.566950000 seconds]
    [SEQ/ACK analysis]
        [iRTT: 0.000496000 seconds]
        [Bytes in flight: 7]
        [Bytes sent since last PSH flag: 7]
    TCP payload (7 bytes)
Data (7 bytes)

0000  14 00 07 88 cc 12 00                              .......
    Data: 14000788cc1200
    [Length: 7]
This is Hello version 0.0.0, a Wireshark postdissector plugin prototype

    5   5.567886 10.158.134.5 → 10.158.134.32 TCP 61 54321 → 51392 [PSH, ACK] Seq=1 Ack=8 Win=2102272 Len=7
Frame 5: 61 bytes on wire (488 bits), 61 bytes captured (488 bits) on interface \Device\NPF_{06E76EDA-507E-41DF-9258-2F74B7137C90}, id 0
    Section number: 1
    Interface id: 0 (\Device\NPF_{06E76EDA-507E-41DF-9258-2F74B7137C90})
        Interface name: \Device\NPF_{06E76EDA-507E-41DF-9258-2F74B7137C90}
        Interface description: Ethernet
    Encapsulation type: Ethernet (1)
    Arrival Time: Jun  6, 2019 13:38:07.793999000 UTC
    [Time shift for this packet: 0.000000000 seconds]
    Epoch Time: 1559828287.793999000 seconds
    [Time delta from previous captured frame: 0.000440000 seconds]
    [Time delta from previous displayed frame: 0.000440000 seconds]
    [Time since reference or first frame: 5.567886000 seconds]
    Frame Number: 5
    Frame Length: 61 bytes (488 bits)
    Capture Length: 61 bytes (488 bits)
    [Frame is marked: False]
    [Frame is ignored: False]
    [Protocols in frame: eth:ethertype:ip:tcp:data]
Ethernet II, Src: Dell_92:7c:f7 (d8:9e:f3:92:7c:f7), Dst: Dell_55:40:83 (5c:26:0a:55:40:83)
    Destination: Dell_55:40:83 (5c:26:0a:55:40:83)
        Address: Dell_55:40:83 (5c:26:0a:55:40:83)
        .... ..0. .... .... .... .... = LG bit: Globally unique address (factory default)
        .... ...0 .... .... .... .... = IG bit: Individual address (unicast)
    Source: Dell_92:7c:f7 (d8:9e:f3:92:7c:f7)
        Address: Dell_92:7c:f7 (d8:9e:f3:92:7c:f7)
        .... ..0. .... .... .... .... = LG bit: Globally unique address (factory default)
        .... ...0 .... .... .... .... = IG bit: Individual address (unicast)
    Type: IPv4 (0x0800)
Internet Protocol Version 4, Src: 10.158.134.5, Dst: 10.158.134.32
    0100 .... = Version: 4
    .... 0101 = Header Length: 20 bytes (5)
    Differentiated Services Field: 0x00 (DSCP: CS0, ECN: Not-ECT)
        0000 00.. = Differentiated Services Codepoint: Default (0)
        .... ..00 = Explicit Congestion Notification: Not ECN-Capable Transport (0)
    Total Length: 47
    Identification: 0x351b (13595)
    010. .... = Flags: 0x2, Don't fragment
        0... .... = Reserved bit: Not set
        .1.. .... = Don't fragment: Set
        ..0. .... = More fragments: Not set
    ...0 0000 0000 0000 = Fragment Offset: 0
    Time to Live: 128
    Protocol: TCP (6)
    Header Checksum: 0x0000 [validation disabled]
    [Header checksum status: Unverified]
    Source Address: 10.158.134.5
    Destination Address: 10.158.134.32
Transmission Control Protocol, Src Port: 54321, Dst Port: 51392, Seq: 1, Ack: 8, Len: 7
    Source Port: 54321
    Destination Port: 51392
    [Stream index: 0]
    [Conversation completeness: Complete, WITH_DATA (31)]
    [TCP Segment Len: 7]
    Sequence Number: 1    (relative sequence number)
    Sequence Number (raw): 1681547180
    [Next Sequence Number: 8    (relative sequence number)]
    Acknowledgment Number: 8    (relative ack number)
    Acknowledgment number (raw): 738756702
    0101 .... = Header Length: 20 bytes (5)
    Flags: 0x018 (PSH, ACK)
        000. .... .... = Reserved: Not set
        ...0 .... .... = Accurate ECN: Not set
        .... 0... .... = Congestion Window Reduced: Not set
        .... .0.. .... = ECN-Echo: Not set
        .... ..0. .... = Urgent: Not set
        .... ...1 .... = Acknowledgment: Set
        .... .... 1... = Push: Set
        .... .... .0.. = Reset: Not set
        .... .... ..0. = Syn: Not set
        .... .... ...0 = Fin: Not set
        [TCP Flags: ·······AP···]
    Window: 8212
    [Calculated window size: 2102272]
    [Window size scaling factor: 256]
    Checksum: 0x2183 [unverified]
    [Checksum Status: Unverified]
    Urgent Pointer: 0
    [Timestamps]
        [Time since first frame in this TCP stream: 5.567886000 seconds]
        [Time since previous frame in this TCP stream: 0.000440000 seconds]
    [SEQ/ACK analysis]
        [This is an ACK to the segment in frame: 4]
        [The RTT to ACK the segment was: 0.000440000 seconds]
        [iRTT: 0.000496000 seconds]
        [Bytes in flight: 7]
        [Bytes sent since last PSH flag: 7]
    TCP payload (7 bytes)
Data (7 bytes)

0000  15 00 07 88 cc 12 00                              .......
    Data: 15000788cc1200
    [Length: 7]
This is Hello version 0.0.0, a Wireshark postdissector plugin prototype

    6   5.568628 10.158.134.32 → 10.158.134.5 TCP 60 51392 → 54321 [PSH, ACK] Seq=8 Ack=8 Win=2102272 Len=4
Frame 6: 60 bytes on wire (480 bits), 60 bytes captured (480 bits) on interface \Device\NPF_{06E76EDA-507E-41DF-9258-2F74B7137C90}, id 0
    Section number: 1
    Interface id: 0 (\Device\NPF_{06E76EDA-507E-41DF-9258-2F74B7137C90})
        Interface name: \Device\NPF_{06E76EDA-507E-41DF-9258-2F74B7137C90}
        Interface description: Ethernet
    Encapsulation type: Ethernet (1)
    Arrival Time: Jun  6, 2019 13:38:07.794741000 UTC
    [Time shift for this packet: 0.000000000 seconds]
    Epoch Time: 1559828287.794741000 seconds
    [Time delta from previous captured frame: 0.000742000 seconds]
    [Time delta from previous displayed frame: 0.000742000 seconds]
    [Time since reference or first frame: 5.568628000 seconds]
    Frame Number: 6
    Frame Length: 60 bytes (480 bits)
    Capture Length: 60 bytes (480 bits)
    [Frame is marked: False]
    [Frame is ignored: False]
    [Protocols in frame: eth:ethertype:ip:tcp:data]
Ethernet II, Src: Dell_55:40:83 (5c:26:0a:55:40:83), Dst: Dell_92:7c:f7 (d8:9e:f3:92:7c:f7)
    Destination: Dell_92:7c:f7 (d8:9e:f3:92:7c:f7)
        Address: Dell_92:7c:f7 (d8:9e:f3:92:7c:f7)
        .... ..0. .... .... .... .... = LG bit: Globally unique address (factory default)
        .... ...0 .... .... .... .... = IG bit: Individual address (unicast)
    Source: Dell_55:40:83 (5c:26:0a:55:40:83)
        Address: Dell_55:40:83 (5c:26:0a:55:40:83)
        .... ..0. .... .... .... .... = LG bit: Globally unique address (factory default)
        .... ...0 .... .... .... .... = IG bit: Individual address (unicast)
    Type: IPv4 (0x0800)
    Padding: 0000
Internet Protocol Version 4, Src: 10.158.134.32, Dst: 10.158.134.5
    0100 .... = Version: 4
    .... 0101 = Header Length: 20 bytes (5)
    Differentiated Services Field: 0x00 (DSCP: CS0, ECN: Not-ECT)
        0000 00.. = Differentiated Services Codepoint: Default (0)
        .... ..00 = Explicit Congestion Notification: Not ECN-Capable Transport (0)
    Total Length: 44
    Identification: 0xe2e4 (58084)
    010. .... = Flags: 0x2, Don't fragment
        0... .... = Reserved bit: Not set
        .1.. .... = Don't fragment: Set
        ..0. .... = More fragments: Not set
    ...0 0000 0000 0000 = Fragment Offset: 0
    Time to Live: 128
    Protocol: TCP (6)
    Header Checksum: 0xf685 [validation disabled]
    [Header checksum status: Unverified]
    Source Address: 10.158.134.32
    Destination Address: 10.158.134.5
Transmission Control Protocol, Src Port: 51392, Dst Port: 54321, Seq: 8, Ack: 8, Len: 4
    Source Port: 51392
    Destination Port: 54321
    [Stream index: 0]
    [Conversation completeness: Complete, WITH_DATA (31)]
    [TCP Segment Len: 4]
    Sequence Number: 8    (relative sequence number)
    Sequence Number (raw): 738756702
    [Next Sequence Number: 12    (relative sequence number)]
    Acknowledgment Number: 8    (relative ack number)
    Acknowledgment number (raw): 1681547187
    0101 .... = Header Length: 20 bytes (5)
    Flags: 0x018 (PSH, ACK)
        000. .... .... = Reserved: Not set
        ...0 .... .... = Accurate ECN: Not set
        .... 0... .... = Congestion Window Reduced: Not set
        .... .0.. .... = ECN-Echo: Not set
        .... ..0. .... = Urgent: Not set
        .... ...1 .... = Acknowledgment: Set
        .... .... 1... = Push: Set
        .... .... .0.. = Reset: Not set
        .... .... ..0. = Syn: Not set
        .... .... ...0 = Fin: Not set
        [TCP Flags: ·······AP···]
    Window: 8212
    [Calculated window size: 2102272]
    [Window size scaling factor: 256]
    Checksum: 0x2d0c [unverified]
    [Checksum Status: Unverified]
    Urgent Pointer: 0
    [Timestamps]
        [Time since first frame in this TCP stream: 5.568628000 seconds]
        [Time since previous frame in this TCP stream: 0.000742000 seconds]
    [SEQ/ACK analysis]
        [This is an ACK to the segment in frame: 5]
        [The RTT to ACK the segment was: 0.000742000 seconds]
        [iRTT: 0.000496000 seconds]
        [Bytes in flight: 4]
        [Bytes sent since last PSH flag: 4]
    TCP payload (4 bytes)
Data (4 bytes)

0000  28 00 04 00                                       (...
    Data: 28000400
    [Length: 4]
This is Hello version 0.0.0, a Wireshark postdissector plugin prototype

    7   5.569057 10.158.134.5 → 10.158.134.32 TCP 60 54321 → 51392 [PSH, ACK] Seq=8 Ack=12 Win=2102272 Len=6
Frame 7: 60 bytes on wire (480 bits), 60 bytes captured (480 bits) on interface \Device\NPF_{06E76EDA-507E-41DF-9258-2F74B7137C90}, id 0
    Section number: 1
    Interface id: 0 (\Device\NPF_{06E76EDA-507E-41DF-9258-2F74B7137C90})
        Interface name: \Device\NPF_{06E76EDA-507E-41DF-9258-2F74B7137C90}
        Interface description: Ethernet
    Encapsulation type: Ethernet (1)
    Arrival Time: Jun  6, 2019 13:38:07.795170000 UTC
    [Time shift for this packet: 0.000000000 seconds]
    Epoch Time: 1559828287.795170000 seconds
    [Time delta from previous captured frame: 0.000429000 seconds]
    [Time delta from previous displayed frame: 0.000429000 seconds]
    [Time since reference or first frame: 5.569057000 seconds]
    Frame Number: 7
    Frame Length: 60 bytes (480 bits)
    Capture Length: 60 bytes (480 bits)
    [Frame is marked: False]
    [Frame is ignored: False]
    [Protocols in frame: eth:ethertype:ip:tcp:data]
Ethernet II, Src: Dell_92:7c:f7 (d8:9e:f3:92:7c:f7), Dst: Dell_55:40:83 (5c:26:0a:55:40:83)
    Destination: Dell_55:40:83 (5c:26:0a:55:40:83)
        Address: Dell_55:40:83 (5c:26:0a:55:40:83)
        .... ..0. .... .... .... .... = LG bit: Globally unique address (factory default)
        .... ...0 .... .... .... .... = IG bit: Individual address (unicast)
    Source: Dell_92:7c:f7 (d8:9e:f3:92:7c:f7)
        Address: Dell_92:7c:f7 (d8:9e:f3:92:7c:f7)
        .... ..0. .... .... .... .... = LG bit: Globally unique address (factory default)
        .... ...0 .... .... .... .... = IG bit: Individual address (unicast)
    Type: IPv4 (0x0800)
Internet Protocol Version 4, Src: 10.158.134.5, Dst: 10.158.134.32
    0100 .... = Version: 4
    .... 0101 = Header Length: 20 bytes (5)
    Differentiated Services Field: 0x00 (DSCP: CS0, ECN: Not-ECT)
        0000 00.. = Differentiated Services Codepoint: Default (0)
        .... ..00 = Explicit Congestion Notification: Not ECN-Capable Transport (0)
    Total Length: 46
    Identification: 0x351c (13596)
    010. .... = Flags: 0x2, Don't fragment
        0... .... = Reserved bit: Not set
        .1.. .... = Don't fragment: Set
        ..0. .... = More fragments: Not set
    ...0 0000 0000 0000 = Fragment Offset: 0
    Time to Live: 128
    Protocol: TCP (6)
    Header Checksum: 0x0000 [validation disabled]
    [Header checksum status: Unverified]
    Source Address: 10.158.134.5
    Destination Address: 10.158.134.32
Transmission Control Protocol, Src Port: 54321, Dst Port: 51392, Seq: 8, Ack: 12, Len: 6
    Source Port: 54321
    Destination Port: 51392
    [Stream index: 0]
    [Conversation completeness: Complete, WITH_DATA (31)]
    [TCP Segment Len: 6]
    Sequence Number: 8    (relative sequence number)
    Sequence Number (raw): 1681547187
    [Next Sequence Number: 14    (relative sequence number)]
    Acknowledgment Number: 12    (relative ack number)
    Acknowledgment number (raw): 738756706
    0101 .... = Header Length: 20 bytes (5)
    Flags: 0x018 (PSH, ACK)
        000. .... .... = Reserved: Not set
        ...0 .... .... = Accurate ECN: Not set
        .... 0... .... = Congestion Window Reduced: Not set
        .... .0.. .... = ECN-Echo: Not set
        .... ..0. .... = Urgent: Not set
        .... ...1 .... = Acknowledgment: Set
        .... .... 1... = Push: Set
        .... .... .0.. = Reset: Not set
        .... .... ..0. = Syn: Not set
        .... .... ...0 = Fin: Not set
        [TCP Flags: ·······AP···]
    Window: 8212
    [Calculated window size: 2102272]
    [Window size scaling factor: 256]
    Checksum: 0x2182 [unverified]
    [Checksum Status: Unverified]
    Urgent Pointer: 0
    [Timestamps]
        [Time since first frame in this TCP stream: 5.569057000 seconds]
        [Time since previous frame in this TCP stream: 0.000429000 seconds]
    [SEQ/ACK analysis]
        [This is an ACK to the segment in frame: 6]
        [The RTT to ACK the segment was: 0.000429000 seconds]
        [iRTT: 0.000496000 seconds]
        [Bytes in flight: 6]
        [Bytes sent since last PSH flag: 6]
    TCP payload (6 bytes)
Data (6 bytes)

0000  29 00 06 00 00 00                                 ).....
    Data: 290006000000
    [Length: 6]
This is Hello version 0.0.0, a Wireshark postdissector plugin prototype

    8   5.569732 10.158.134.32 → 10.158.134.5 TCP 60 51392 → 54321 [PSH, ACK] Seq=12 Ack=14 Win=2102272 Len=4
Frame 8: 60 bytes on wire (480 bits), 60 bytes captured (480 bits) on interface \Device\NPF_{06E76EDA-507E-41DF-9258-2F74B7137C90}, id 0
    Section number: 1
    Interface id: 0 (\Device\NPF_{06E76EDA-507E-41DF-9258-2F74B7137C90})
        Interface name: \Device\NPF_{06E76EDA-507E-41DF-9258-2F74B7137C90}
        Interface description: Ethernet
    Encapsulation type: Ethernet (1)
    Arrival Time: Jun  6, 2019 13:38:07.795845000 UTC
    [Time shift for this packet: 0.000000000 seconds]
    Epoch Time: 1559828287.795845000 seconds
    [Time delta from previous captured frame: 0.000675000 seconds]
    [Time delta from previous displayed frame: 0.000675000 seconds]
    [Time since reference or first frame: 5.569732000 seconds]
    Frame Number: 8
    Frame Length: 60 bytes (480 bits)
    Capture Length: 60 bytes (480 bits)
    [Frame is marked: False]
    [Frame is ignored: False]
    [Protocols in frame: eth:ethertype:ip:tcp:data]
Ethernet II, Src: Dell_55:40:83 (5c:26:0a:55:40:83), Dst: Dell_92:7c:f7 (d8:9e:f3:92:7c:f7)
    Destination: Dell_92:7c:f7 (d8:9e:f3:92:7c:f7)
        Address: Dell_92:7c:f7 (d8:9e:f3:92:7c:f7)
        .... ..0. .... .... .... .... = LG bit: Globally unique address (factory default)
        .... ...0 .... .... .... .... = IG bit: Individual address (unicast)
    Source: Dell_55:40:83 (5c:26:0a:55:40:83)
        Address: Dell_55:40:83 (5c:26:0a:55:40:83)
        .... ..0. .... .... .... .... = LG bit: Globally unique address (factory default)
        .... ...0 .... .... .... .... = IG bit: Individual address (unicast)
    Type: IPv4 (0x0800)
    Padding: 0000
Internet Protocol Version 4, Src: 10.158.134.32, Dst: 10.158.134.5
    0100 .... = Version: 4
    .... 0101 = Header Length: 20 bytes (5)
    Differentiated Services Field: 0x00 (DSCP: CS0, ECN: Not-ECT)
        0000 00.. = Differentiated Services Codepoint: Default (0)
        .... ..00 = Explicit Congestion Notification: Not ECN-Capable Transport (0)
    Total Length: 44
    Identification: 0xe2e5 (58085)
    010. .... = Flags: 0x2, Don't fragment
        0... .... = Reserved bit: Not set
        .1.. .... = Don't fragment: Set
        ..0. .... = More fragments: Not set
    ...0 0000 0000 0000 = Fragment Offset: 0
    Time to Live: 128
    Protocol: TCP (6)
    Header Checksum: 0xf684 [validation disabled]
    [Header checksum status: Unverified]
    Source Address: 10.158.134.32
    Destination Address: 10.158.134.5
Transmission Control Protocol, Src Port: 51392, Dst Port: 54321, Seq: 12, Ack: 14, Len: 4
    Source Port: 51392
    Destination Port: 54321
    [Stream index: 0]
    [Conversation completeness: Complete, WITH_DATA (31)]
    [TCP Segment Len: 4]
    Sequence Number: 12    (relative sequence number)
    Sequence Number (raw): 738756706
    [Next Sequence Number: 16    (relative sequence number)]
    Acknowledgment Number: 14    (relative ack number)
    Acknowledgment number (raw): 1681547193
    0101 .... = Header Length: 20 bytes (5)
    Flags: 0x018 (PSH, ACK)
        000. .... .... = Reserved: Not set
        ...0 .... .... = Accurate ECN: Not set
        .... 0... .... = Congestion Window Reduced: Not set
        .... .0.. .... = ECN-Echo: Not set
        .... ..0. .... = Urgent: Not set
        .... ...1 .... = Acknowledgment: Set
        .... .... 1... = Push: Set
        .... .... .0.. = Reset: Not set
        .... .... ..0. = Syn: Not set
        .... .... ...0 = Fin: Not set
        [TCP Flags: ·······AP···]
    Window: 8212
    [Calculated window size: 2102272]
    [Window size scaling factor: 256]
    Checksum: 0x2d01 [unverified]
    [Checksum Status: Unverified]
    Urgent Pointer: 0
    [Timestamps]
        [Time since first frame in this TCP stream: 5.569732000 seconds]
        [Time since previous frame in this TCP stream: 0.000675000 seconds]
    [SEQ/ACK analysis]
        [This is an ACK to the segment in frame: 7]
        [The RTT to ACK the segment was: 0.000675000 seconds]
        [iRTT: 0.000496000 seconds]
        [Bytes in flight: 4]
        [Bytes sent since last PSH flag: 4]
    TCP payload (4 bytes)
Data (4 bytes)

0000  28 00 04 01                                       (...
    Data: 28000401
    [Length: 4]
This is Hello version 0.0.0, a Wireshark postdissector plugin prototype

    9   5.570180 10.158.134.5 → 10.158.134.32 TCP 62 54321 → 51392 [PSH, ACK] Seq=14 Ack=16 Win=2102272 Len=8
Frame 9: 62 bytes on wire (496 bits), 62 bytes captured (496 bits) on interface \Device\NPF_{06E76EDA-507E-41DF-9258-2F74B7137C90}, id 0
    Section number: 1
    Interface id: 0 (\Device\NPF_{06E76EDA-507E-41DF-9258-2F74B7137C90})
        Interface name: \Device\NPF_{06E76EDA-507E-41DF-9258-2F74B7137C90}
        Interface description: Ethernet
    Encapsulation type: Ethernet (1)
    Arrival Time: Jun  6, 2019 13:38:07.796293000 UTC
    [Time shift for this packet: 0.000000000 seconds]
    Epoch Time: 1559828287.796293000 seconds
    [Time delta from previous captured frame: 0.000448000 seconds]
    [Time delta from previous displayed frame: 0.000448000 seconds]
    [Time since reference or first frame: 5.570180000 seconds]
    Frame Number: 9
    Frame Length: 62 bytes (496 bits)
    Capture Length: 62 bytes (496 bits)
    [Frame is marked: False]
    [Frame is ignored: False]
    [Protocols in frame: eth:ethertype:ip:tcp:data]
Ethernet II, Src: Dell_92:7c:f7 (d8:9e:f3:92:7c:f7), Dst: Dell_55:40:83 (5c:26:0a:55:40:83)
    Destination: Dell_55:40:83 (5c:26:0a:55:40:83)
        Address: Dell_55:40:83 (5c:26:0a:55:40:83)
        .... ..0. .... .... .... .... = LG bit: Globally unique address (factory default)
        .... ...0 .... .... .... .... = IG bit: Individual address (unicast)
    Source: Dell_92:7c:f7 (d8:9e:f3:92:7c:f7)
        Address: Dell_92:7c:f7 (d8:9e:f3:92:7c:f7)
        .... ..0. .... .... .... .... = LG bit: Globally unique address (factory default)
        .... ...0 .... .... .... .... = IG bit: Individual address (unicast)
    Type: IPv4 (0x0800)
Internet Protocol Version 4, Src: 10.158.134.5, Dst: 10.158.134.32
    0100 .... = Version: 4
    .... 0101 = Header Length: 20 bytes (5)
    Differentiated Services Field: 0x00 (DSCP: CS0, ECN: Not-ECT)
        0000 00.. = Differentiated Services Codepoint: Default (0)
        .... ..00 = Explicit Congestion Notification: Not ECN-Capable Transport (0)
    Total Length: 48
    Identification: 0x351d (13597)
    010. .... = Flags: 0x2, Don't fragment
        0... .... = Reserved bit: Not set
        .1.. .... = Don't fragment: Set
        ..0. .... = More fragments: Not set
    ...0 0000 0000 0000 = Fragment Offset: 0
    Time to Live: 128
    Protocol: TCP (6)
    Header Checksum: 0x0000 [validation disabled]
    [Header checksum status: Unverified]
    Source Address: 10.158.134.5
    Destination Address: 10.158.134.32
Transmission Control Protocol, Src Port: 54321, Dst Port: 51392, Seq: 14, Ack: 16, Len: 8
    Source Port: 54321
    Destination Port: 51392
    [Stream index: 0]
    [Conversation completeness: Complete, WITH_DATA (31)]
    [TCP Segment Len: 8]
    Sequence Number: 14    (relative sequence number)
    Sequence Number (raw): 1681547193
    [Next Sequence Number: 22    (relative sequence number)]
    Acknowledgment Number: 16    (relative ack number)
    Acknowledgment number (raw): 738756710
    0101 .... = Header Length: 20 bytes (5)
    Flags: 0x018 (PSH, ACK)
        000. .... .... = Reserved: Not set
        ...0 .... .... = Accurate ECN: Not set
        .... 0... .... = Congestion Window Reduced: Not set
        .... .0.. .... = ECN-Echo: Not set
        .... ..0. .... = Urgent: Not set
        .... ...1 .... = Acknowledgment: Set
        .... .... 1... = Push: Set
        .... .... .0.. = Reset: Not set
        .... .... ..0. = Syn: Not set
        .... .... ...0 = Fin: Not set
        [TCP Flags: ·······AP···]
    Window: 8212
    [Calculated window size: 2102272]
    [Window size scaling factor: 256]
    Checksum: 0x2184 [unverified]
    [Checksum Status: Unverified]
    Urgent Pointer: 0
    [Timestamps]
        [Time since first frame in this TCP stream: 5.570180000 seconds]
        [Time since previous frame in this TCP stream: 0.000448000 seconds]
    [SEQ/ACK analysis]
        [This is an ACK to the segment in frame: 8]
        [The RTT to ACK the segment was: 0.000448000 seconds]
        [iRTT: 0.000496000 seconds]
        [Bytes in flight: 8]
        [Bytes sent since last PSH flag: 8]
    TCP payload (8 bytes)
Data (8 bytes)

0000  29 00 08 01 01 00 00 00                           ).......
    Data: 2900080101000000
    [Length: 8]
This is Hello version 0.0.0, a Wireshark postdissector plugin prototype

   10   5.570640 10.158.134.32 → 10.158.134.5 TCP 60 51392 → 54321 [PSH, ACK] Seq=16 Ack=22 Win=2102272 Len=4
Frame 10: 60 bytes on wire (480 bits), 60 bytes captured (480 bits) on interface \Device\NPF_{06E76EDA-507E-41DF-9258-2F74B7137C90}, id 0
    Section number: 1
    Interface id: 0 (\Device\NPF_{06E76EDA-507E-41DF-9258-2F74B7137C90})
        Interface name: \Device\NPF_{06E76EDA-507E-41DF-9258-2F74B7137C90}
        Interface description: Ethernet
    Encapsulation type: Ethernet (1)
    Arrival Time: Jun  6, 2019 13:38:07.796753000 UTC
    [Time shift for this packet: 0.000000000 seconds]
    Epoch Time: 1559828287.796753000 seconds
    [Time delta from previous captured frame: 0.000460000 seconds]
    [Time delta from previous displayed frame: 0.000460000 seconds]
    [Time since reference or first frame: 5.570640000 seconds]
    Frame Number: 10
    Frame Length: 60 bytes (480 bits)
    Capture Length: 60 bytes (480 bits)
    [Frame is marked: False]
    [Frame is ignored: False]
    [Protocols in frame: eth:ethertype:ip:tcp:data]
Ethernet II, Src: Dell_55:40:83 (5c:26:0a:55:40:83), Dst: Dell_92:7c:f7 (d8:9e:f3:92:7c:f7)
    Destination: Dell_92:7c:f7 (d8:9e:f3:92:7c:f7)
        Address: Dell_92:7c:f7 (d8:9e:f3:92:7c:f7)
        .... ..0. .... .... .... .... = LG bit: Globally unique address (factory default)
        .... ...0 .... .... .... .... = IG bit: Individual address (unicast)
    Source: Dell_55:40:83 (5c:26:0a:55:40:83)
        Address: Dell_55:40:83 (5c:26:0a:55:40:83)
        .... ..0. .... .... .... .... = LG bit: Globally unique address (factory default)
        .... ...0 .... .... .... .... = IG bit: Individual address (unicast)
    Type: IPv4 (0x0800)
    Padding: 0000
Internet Protocol Version 4, Src: 10.158.134.32, Dst: 10.158.134.5
    0100 .... = Version: 4
    .... 0101 = Header Length: 20 bytes (5)
    Differentiated Services Field: 0x00 (DSCP: CS0, ECN: Not-ECT)
        0000 00.. = Differentiated Services Codepoint: Default (0)
        .... ..00 = Explicit Congestion Notification: Not ECN-Capable Transport (0)
    Total Length: 44
    Identification: 0xe2e6 (58086)
    010. .... = Flags: 0x2, Don't fragment
        0... .... = Reserved bit: Not set
        .1.. .... = Don't fragment: Set
        ..0. .... = More fragments: Not set
    ...0 0000 0000 0000 = Fragment Offset: 0
    Time to Live: 128
    Protocol: TCP (6)
    Header Checksum: 0xf683 [validation disabled]
    [Header checksum status: Unverified]
    Source Address: 10.158.134.32
    Destination Address: 10.158.134.5
Transmission Control Protocol, Src Port: 51392, Dst Port: 54321, Seq: 16, Ack: 22, Len: 4
    Source Port: 51392
    Destination Port: 54321
    [Stream index: 0]
    [Conversation completeness: Complete, WITH_DATA (31)]
    [TCP Segment Len: 4]
    Sequence Number: 16    (relative sequence number)
    Sequence Number (raw): 738756710
    [Next Sequence Number: 20    (relative sequence number)]
    Acknowledgment Number: 22    (relative ack number)
    Acknowledgment number (raw): 1681547201
    0101 .... = Header Length: 20 bytes (5)
    Flags: 0x018 (PSH, ACK)
        000. .... .... = Reserved: Not set
        ...0 .... .... = Accurate ECN: Not set
        .... 0... .... = Congestion Window Reduced: Not set
        .... .0.. .... = ECN-Echo: Not set
        .... ..0. .... = Urgent: Not set
        .... ...1 .... = Acknowledgment: Set
        .... .... 1... = Push: Set
        .... .... .0.. = Reset: Not set
        .... .... ..0. = Syn: Not set
        .... .... ...0 = Fin: Not set
        [TCP Flags: ·······AP···]
    Window: 8212
    [Calculated window size: 2102272]
    [Window size scaling factor: 256]
    Checksum: 0x2cf4 [unverified]
    [Checksum Status: Unverified]
    Urgent Pointer: 0
    [Timestamps]
        [Time since first frame in this TCP stream: 5.570640000 seconds]
        [Time since previous frame in this TCP stream: 0.000460000 seconds]
    [SEQ/ACK analysis]
        [This is an ACK to the segment in frame: 9]
        [The RTT to ACK the segment was: 0.000460000 seconds]
        [iRTT: 0.000496000 seconds]
        [Bytes in flight: 4]
        [Bytes sent since last PSH flag: 4]
    TCP payload (4 bytes)
Data (4 bytes)

0000  28 00 04 02                                       (...
    Data: 28000402
    [Length: 4]
This is Hello version 0.0.0, a Wireshark postdissector plugin prototype

   11   5.572283 10.158.134.5 → 10.158.134.32 TCP 73 54321 → 51392 [PSH, ACK] Seq=22 Ack=20 Win=2102272 Len=19
Frame 11: 73 bytes on wire (584 bits), 73 bytes captured (584 bits) on interface \Device\NPF_{06E76EDA-507E-41DF-9258-2F74B7137C90}, id 0
    Section number: 1
    Interface id: 0 (\Device\NPF_{06E76EDA-507E-41DF-9258-2F74B7137C90})
        Interface name: \Device\NPF_{06E76EDA-507E-41DF-9258-2F74B7137C90}
        Interface description: Ethernet
    Encapsulation type: Ethernet (1)
    Arrival Time: Jun  6, 2019 13:38:07.798396000 UTC
    [Time shift for this packet: 0.000000000 seconds]
    Epoch Time: 1559828287.798396000 seconds
    [Time delta from previous captured frame: 0.001643000 seconds]
    [Time delta from previous displayed frame: 0.001643000 seconds]
    [Time since reference or first frame: 5.572283000 seconds]
    Frame Number: 11
    Frame Length: 73 bytes (584 bits)
    Capture Length: 73 bytes (584 bits)
    [Frame is marked: False]
    [Frame is ignored: False]
    [Protocols in frame: eth:ethertype:ip:tcp:data]
Ethernet II, Src: Dell_92:7c:f7 (d8:9e:f3:92:7c:f7), Dst: Dell_55:40:83 (5c:26:0a:55:40:83)
    Destination: Dell_55:40:83 (5c:26:0a:55:40:83)
        Address: Dell_55:40:83 (5c:26:0a:55:40:83)
        .... ..0. .... .... .... .... = LG bit: Globally unique address (factory default)
        .... ...0 .... .... .... .... = IG bit: Individual address (unicast)
    Source: Dell_92:7c:f7 (d8:9e:f3:92:7c:f7)
        Address: Dell_92:7c:f7 (d8:9e:f3:92:7c:f7)
        .... ..0. .... .... .... .... = LG bit: Globally unique address (factory default)
        .... ...0 .... .... .... .... = IG bit: Individual address (unicast)
    Type: IPv4 (0x0800)
Internet Protocol Version 4, Src: 10.158.134.5, Dst: 10.158.134.32
    0100 .... = Version: 4
    .... 0101 = Header Length: 20 bytes (5)
    Differentiated Services Field: 0x00 (DSCP: CS0, ECN: Not-ECT)
        0000 00.. = Differentiated Services Codepoint: Default (0)
        .... ..00 = Explicit Congestion Notification: Not ECN-Capable Transport (0)
    Total Length: 59
    Identification: 0x351e (13598)
    010. .... = Flags: 0x2, Don't fragment
        0... .... = Reserved bit: Not set
        .1.. .... = Don't fragment: Set
        ..0. .... = More fragments: Not set
    ...0 0000 0000 0000 = Fragment Offset: 0
    Time to Live: 128
    Protocol: TCP (6)
    Header Checksum: 0x0000 [validation disabled]
    [Header checksum status: Unverified]
    Source Address: 10.158.134.5
    Destination Address: 10.158.134.32
Transmission Control Protocol, Src Port: 54321, Dst Port: 51392, Seq: 22, Ack: 20, Len: 19
    Source Port: 54321
    Destination Port: 51392
    [Stream index: 0]
    [Conversation completeness: Complete, WITH_DATA (31)]
    [TCP Segment Len: 19]
    Sequence Number: 22    (relative sequence number)
    Sequence Number (raw): 1681547201
    [Next Sequence Number: 41    (relative sequence number)]
    Acknowledgment Number: 20    (relative ack number)
    Acknowledgment number (raw): 738756714
    0101 .... = Header Length: 20 bytes (5)
    Flags: 0x018 (PSH, ACK)
        000. .... .... = Reserved: Not set
        ...0 .... .... = Accurate ECN: Not set
        .... 0... .... = Congestion Window Reduced: Not set
        .... .0.. .... = ECN-Echo: Not set
        .... ..0. .... = Urgent: Not set
        .... ...1 .... = Acknowledgment: Set
        .... .... 1... = Push: Set
        .... .... .0.. = Reset: Not set
        .... .... ..0. = Syn: Not set
        .... .... ...0 = Fin: Not set
        [TCP Flags: ·······AP···]
    Window: 8212
    [Calculated window size: 2102272]
    [Window size scaling factor: 256]
    Checksum: 0x218f [unverified]
    [Checksum Status: Unverified]
    Urgent Pointer: 0
    [Timestamps]
        [Time since first frame in this TCP stream: 5.572283000 seconds]
        [Time since previous frame in this TCP stream: 0.001643000 seconds]
    [SEQ/ACK analysis]
        [This is an ACK to the segment in frame: 10]
        [The RTT to ACK the segment was: 0.001643000 seconds]
        [iRTT: 0.000496000 seconds]
        [Bytes in flight: 19]
        [Bytes sent since last PSH flag: 19]
    TCP payload (19 bytes)
Data (19 bytes)

0000  29 00 13 02 53 68 61 72 6b 46 65 73 74 27 31 39   )...SharkFest'19
0010  3a 20 32                                          : 2
    Data: 29001302536861726b466573742731393a2032
    [Length: 19]
This is Hello version 0.0.0, a Wireshark postdissector plugin prototype

   12   5.572848 10.158.134.32 → 10.158.134.5 TCP 61 51392 → 54321 [PSH, ACK] Seq=20 Ack=41 Win=2102272 Len=7
Frame 12: 61 bytes on wire (488 bits), 61 bytes captured (488 bits) on interface \Device\NPF_{06E76EDA-507E-41DF-9258-2F74B7137C90}, id 0
    Section number: 1
    Interface id: 0 (\Device\NPF_{06E76EDA-507E-41DF-9258-2F74B7137C90})
        Interface name: \Device\NPF_{06E76EDA-507E-41DF-9258-2F74B7137C90}
        Interface description: Ethernet
    Encapsulation type: Ethernet (1)
    Arrival Time: Jun  6, 2019 13:38:07.798961000 UTC
    [Time shift for this packet: 0.000000000 seconds]
    Epoch Time: 1559828287.798961000 seconds
    [Time delta from previous captured frame: 0.000565000 seconds]
    [Time delta from previous displayed frame: 0.000565000 seconds]
    [Time since reference or first frame: 5.572848000 seconds]
    Frame Number: 12
    Frame Length: 61 bytes (488 bits)
    Capture Length: 61 bytes (488 bits)
    [Frame is marked: False]
    [Frame is ignored: False]
    [Protocols in frame: eth:ethertype:ip:tcp:data]
Ethernet II, Src: Dell_55:40:83 (5c:26:0a:55:40:83), Dst: Dell_92:7c:f7 (d8:9e:f3:92:7c:f7)
    Destination: Dell_92:7c:f7 (d8:9e:f3:92:7c:f7)
        Address: Dell_92:7c:f7 (d8:9e:f3:92:7c:f7)
        .... ..0. .... .... .... .... = LG bit: Globally unique address (factory default)
        .... ...0 .... .... .... .... = IG bit: Individual address (unicast)
    Source: Dell_55:40:83 (5c:26:0a:55:40:83)
        Address: Dell_55:40:83 (5c:26:0a:55:40:83)
        .... ..0. .... .... .... .... = LG bit: Globally unique address (factory default)
        .... ...0 .... .... .... .... = IG bit: Individual address (unicast)
    Type: IPv4 (0x0800)
Internet Protocol Version 4, Src: 10.158.134.32, Dst: 10.158.134.5
    0100 .... = Version: 4
    .... 0101 = Header Length: 20 bytes (5)
    Differentiated Services Field: 0x00 (DSCP: CS0, ECN: Not-ECT)
        0000 00.. = Differentiated Services Codepoint: Default (0)
        .... ..00 = Explicit Congestion Notification: Not ECN-Capable Transport (0)
    Total Length: 47
    Identification: 0xe2e7 (58087)
    010. .... = Flags: 0x2, Don't fragment
        0... .... = Reserved bit: Not set
        .1.. .... = Don't fragment: Set
        ..0. .... = More fragments: Not set
    ...0 0000 0000 0000 = Fragment Offset: 0
    Time to Live: 128
    Protocol: TCP (6)
    Header Checksum: 0xf67f [validation disabled]
    [Header checksum status: Unverified]
    Source Address: 10.158.134.32
    Destination Address: 10.158.134.5
Transmission Control Protocol, Src Port: 51392, Dst Port: 54321, Seq: 20, Ack: 41, Len: 7
    Source Port: 51392
    Destination Port: 54321
    [Stream index: 0]
    [Conversation completeness: Complete, WITH_DATA (31)]
    [TCP Segment Len: 7]
    Sequence Number: 20    (relative sequence number)
    Sequence Number (raw): 738756714
    [Next Sequence Number: 27    (relative sequence number)]
    Acknowledgment Number: 41    (relative ack number)
    Acknowledgment number (raw): 1681547220
    0101 .... = Header Length: 20 bytes (5)
    Flags: 0x018 (PSH, ACK)
        000. .... .... = Reserved: Not set
        ...0 .... .... = Accurate ECN: Not set
        .... 0... .... = Congestion Window Reduced: Not set
        .... .0.. .... = ECN-Echo: Not set
        .... ..0. .... = Urgent: Not set
        .... ...1 .... = Acknowledgment: Set
        .... .... 1... = Push: Set
        .... .... .0.. = Reset: Not set
        .... .... ..0. = Syn: Not set
        .... .... ...0 = Fin: Not set
        [TCP Flags: ·······AP···]
    Window: 8212
    [Calculated window size: 2102272]
    [Window size scaling factor: 256]
    Checksum: 0x4941 [unverified]
    [Checksum Status: Unverified]
    Urgent Pointer: 0
    [Timestamps]
        [Time since first frame in this TCP stream: 5.572848000 seconds]
        [Time since previous frame in this TCP stream: 0.000565000 seconds]
    [SEQ/ACK analysis]
        [This is an ACK to the segment in frame: 11]
        [The RTT to ACK the segment was: 0.000565000 seconds]
        [iRTT: 0.000496000 seconds]
        [Bytes in flight: 7]
        [Bytes sent since last PSH flag: 7]
    TCP payload (7 bytes)
Data (7 bytes)

0000  3c 00 07 88 cc 12 00                              <......
    Data: 3c000788cc1200
    [Length: 7]
This is Hello version 0.0.0, a Wireshark postdissector plugin prototype

   13   5.573104 10.158.134.5 → 10.158.134.32 TCP 61 54321 → 51392 [PSH, ACK] Seq=41 Ack=27 Win=2102272 Len=7
Frame 13: 61 bytes on wire (488 bits), 61 bytes captured (488 bits) on interface \Device\NPF_{06E76EDA-507E-41DF-9258-2F74B7137C90}, id 0
    Section number: 1
    Interface id: 0 (\Device\NPF_{06E76EDA-507E-41DF-9258-2F74B7137C90})
        Interface name: \Device\NPF_{06E76EDA-507E-41DF-9258-2F74B7137C90}
        Interface description: Ethernet
    Encapsulation type: Ethernet (1)
    Arrival Time: Jun  6, 2019 13:38:07.799217000 UTC
    [Time shift for this packet: 0.000000000 seconds]
    Epoch Time: 1559828287.799217000 seconds
    [Time delta from previous captured frame: 0.000256000 seconds]
    [Time delta from previous displayed frame: 0.000256000 seconds]
    [Time since reference or first frame: 5.573104000 seconds]
    Frame Number: 13
    Frame Length: 61 bytes (488 bits)
    Capture Length: 61 bytes (488 bits)
    [Frame is marked: False]
    [Frame is ignored: False]
    [Protocols in frame: eth:ethertype:ip:tcp:data]
Ethernet II, Src: Dell_92:7c:f7 (d8:9e:f3:92:7c:f7), Dst: Dell_55:40:83 (5c:26:0a:55:40:83)
    Destination: Dell_55:40:83 (5c:26:0a:55:40:83)
        Address: Dell_55:40:83 (5c:26:0a:55:40:83)
        .... ..0. .... .... .... .... = LG bit: Globally unique address (factory default)
        .... ...0 .... .... .... .... = IG bit: Individual address (unicast)
    Source: Dell_92:7c:f7 (d8:9e:f3:92:7c:f7)
        Address: Dell_92:7c:f7 (d8:9e:f3:92:7c:f7)
        .... ..0. .... .... .... .... = LG bit: Globally unique address (factory default)
        .... ...0 .... .... .... .... = IG bit: Individual address (unicast)
    Type: IPv4 (0x0800)
Internet Protocol Version 4, Src: 10.158.134.5, Dst: 10.158.134.32
    0100 .... = Version: 4
    .... 0101 = Header Length: 20 bytes (5)
    Differentiated Services Field: 0x00 (DSCP: CS0, ECN: Not-ECT)
        0000 00.. = Differentiated Services Codepoint: Default (0)
        .... ..00 = Explicit Congestion Notification: Not ECN-Capable Transport (0)
    Total Length: 47
    Identification: 0x351f (13599)
    010. .... = Flags: 0x2, Don't fragment
        0... .... = Reserved bit: Not set
        .1.. .... = Don't fragment: Set
        ..0. .... = More fragments: Not set
    ...0 0000 0000 0000 = Fragment Offset: 0
    Time to Live: 128
    Protocol: TCP (6)
    Header Checksum: 0x0000 [validation disabled]
    [Header checksum status: Unverified]
    Source Address: 10.158.134.5
    Destination Address: 10.158.134.32
Transmission Control Protocol, Src Port: 54321, Dst Port: 51392, Seq: 41, Ack: 27, Len: 7
    Source Port: 54321
    Destination Port: 51392
    [Stream index: 0]
    [Conversation completeness: Complete, WITH_DATA (31)]
    [TCP Segment Len: 7]
    Sequence Number: 41    (relative sequence number)
    Sequence Number (raw): 1681547220
    [Next Sequence Number: 48    (relative sequence number)]
    Acknowledgment Number: 27    (relative ack number)
    Acknowledgment number (raw): 738756721
    0101 .... = Header Length: 20 bytes (5)
    Flags: 0x018 (PSH, ACK)
        000. .... .... = Reserved: Not set
        ...0 .... .... = Accurate ECN: Not set
        .... 0... .... = Congestion Window Reduced: Not set
        .... .0.. .... = ECN-Echo: Not set
        .... ..0. .... = Urgent: Not set
        .... ...1 .... = Acknowledgment: Set
        .... .... 1... = Push: Set
        .... .... .0.. = Reset: Not set
        .... .... ..0. = Syn: Not set
        .... .... ...0 = Fin: Not set
        [TCP Flags: ·······AP···]
    Window: 8212
    [Calculated window size: 2102272]
    [Window size scaling factor: 256]
    Checksum: 0x2183 [unverified]
    [Checksum Status: Unverified]
    Urgent Pointer: 0
    [Timestamps]
        [Time since first frame in this TCP stream: 5.573104000 seconds]
        [Time since previous frame in this TCP stream: 0.000256000 seconds]
    [SEQ/ACK analysis]
        [This is an ACK to the segment in frame: 12]
        [The RTT to ACK the segment was: 0.000256000 seconds]
        [iRTT: 0.000496000 seconds]
        [Bytes in flight: 7]
        [Bytes sent since last PSH flag: 7]
    TCP payload (7 bytes)
Data (7 bytes)

0000  3d 00 07 88 cc 12 00                              =......
    Data: 3d000788cc1200
    [Length: 7]
This is Hello version 0.0.0, a Wireshark postdissector plugin prototype

   14   5.614222 10.158.134.32 → 10.158.134.5 TCP 60 51392 → 54321 [ACK] Seq=27 Ack=48 Win=2102272 Len=0
Frame 14: 60 bytes on wire (480 bits), 60 bytes captured (480 bits) on interface \Device\NPF_{06E76EDA-507E-41DF-9258-2F74B7137C90}, id 0
    Section number: 1
    Interface id: 0 (\Device\NPF_{06E76EDA-507E-41DF-9258-2F74B7137C90})
        Interface name: \Device\NPF_{06E76EDA-507E-41DF-9258-2F74B7137C90}
        Interface description: Ethernet
    Encapsulation type: Ethernet (1)
    Arrival Time: Jun  6, 2019 13:38:07.840335000 UTC
    [Time shift for this packet: 0.000000000 seconds]
    Epoch Time: 1559828287.840335000 seconds
    [Time delta from previous captured frame: 0.041118000 seconds]
    [Time delta from previous displayed frame: 0.041118000 seconds]
    [Time since reference or first frame: 5.614222000 seconds]
    Frame Number: 14
    Frame Length: 60 bytes (480 bits)
    Capture Length: 60 bytes (480 bits)
    [Frame is marked: False]
    [Frame is ignored: False]
    [Protocols in frame: eth:ethertype:ip:tcp]
Ethernet II, Src: Dell_55:40:83 (5c:26:0a:55:40:83), Dst: Dell_92:7c:f7 (d8:9e:f3:92:7c:f7)
    Destination: Dell_92:7c:f7 (d8:9e:f3:92:7c:f7)
        Address: Dell_92:7c:f7 (d8:9e:f3:92:7c:f7)
        .... ..0. .... .... .... .... = LG bit: Globally unique address (factory default)
        .... ...0 .... .... .... .... = IG bit: Individual address (unicast)
    Source: Dell_55:40:83 (5c:26:0a:55:40:83)
        Address: Dell_55:40:83 (5c:26:0a:55:40:83)
        .... ..0. .... .... .... .... = LG bit: Globally unique address (factory default)
        .... ...0 .... .... .... .... = IG bit: Individual address (unicast)
    Type: IPv4 (0x0800)
    Padding: 000000000000
Internet Protocol Version 4, Src: 10.158.134.32, Dst: 10.158.134.5
    0100 .... = Version: 4
    .... 0101 = Header Length: 20 bytes (5)
    Differentiated Services Field: 0x00 (DSCP: CS0, ECN: Not-ECT)
        0000 00.. = Differentiated Services Codepoint: Default (0)
        .... ..00 = Explicit Congestion Notification: Not ECN-Capable Transport (0)
    Total Length: 40
    Identification: 0xe2e8 (58088)
    010. .... = Flags: 0x2, Don't fragment
        0... .... = Reserved bit: Not set
        .1.. .... = Don't fragment: Set
        ..0. .... = More fragments: Not set
    ...0 0000 0000 0000 = Fragment Offset: 0
    Time to Live: 128
    Protocol: TCP (6)
    Header Checksum: 0xf685 [validation disabled]
    [Header checksum status: Unverified]
    Source Address: 10.158.134.32
    Destination Address: 10.158.134.5
Transmission Control Protocol, Src Port: 51392, Dst Port: 54321, Seq: 27, Ack: 48, Len: 0
    Source Port: 51392
    Destination Port: 54321
    [Stream index: 0]
    [Conversation completeness: Complete, WITH_DATA (31)]
    [TCP Segment Len: 0]
    Sequence Number: 27    (relative sequence number)
    Sequence Number (raw): 738756721
    [Next Sequence Number: 27    (relative sequence number)]
    Acknowledgment Number: 48    (relative ack number)
    Acknowledgment number (raw): 1681547227
    0101 .... = Header Length: 20 bytes (5)
    Flags: 0x010 (ACK)
        000. .... .... = Reserved: Not set
        ...0 .... .... = Accurate ECN: Not set
        .... 0... .... = Congestion Window Reduced: Not set
        .... .0.. .... = ECN-Echo: Not set
        .... ..0. .... = Urgent: Not set
        .... ...1 .... = Acknowledgment: Set
        .... .... 0... = Push: Not set
        .... .... .0.. = Reset: Not set
        .... .... ..0. = Syn: Not set
        .... .... ...0 = Fin: Not set
        [TCP Flags: ·······A····]
    Window: 8212
    [Calculated window size: 2102272]
    [Window size scaling factor: 256]
    Checksum: 0x58dd [unverified]
    [Checksum Status: Unverified]
    Urgent Pointer: 0
    [Timestamps]
        [Time since first frame in this TCP stream: 5.614222000 seconds]
        [Time since previous frame in this TCP stream: 0.041118000 seconds]
    [SEQ/ACK analysis]
        [This is an ACK to the segment in frame: 13]
        [The RTT to ACK the segment was: 0.041118000 seconds]
        [iRTT: 0.000496000 seconds]
This is Hello version 0.0.0, a Wireshark postdissector plugin prototype

   15  12.175168 10.158.134.32 → 10.158.134.5 TCP 60 51392 → 54321 [FIN, ACK] Seq=27 Ack=48 Win=2102272 Len=0
Frame 15: 60 bytes on wire (480 bits), 60 bytes captured (480 bits) on interface \Device\NPF_{06E76EDA-507E-41DF-9258-2F74B7137C90}, id 0
    Section number: 1
    Interface id: 0 (\Device\NPF_{06E76EDA-507E-41DF-9258-2F74B7137C90})
        Interface name: \Device\NPF_{06E76EDA-507E-41DF-9258-2F74B7137C90}
        Interface description: Ethernet
    Encapsulation type: Ethernet (1)
    Arrival Time: Jun  6, 2019 13:38:14.401281000 UTC
    [Time shift for this packet: 0.000000000 seconds]
    Epoch Time: 1559828294.401281000 seconds
    [Time delta from previous captured frame: 6.560946000 seconds]
    [Time delta from previous displayed frame: 6.560946000 seconds]
    [Time since reference or first frame: 12.175168000 seconds]
    Frame Number: 15
    Frame Length: 60 bytes (480 bits)
    Capture Length: 60 bytes (480 bits)
    [Frame is marked: False]
    [Frame is ignored: False]
    [Protocols in frame: eth:ethertype:ip:tcp]
Ethernet II, Src: Dell_55:40:83 (5c:26:0a:55:40:83), Dst: Dell_92:7c:f7 (d8:9e:f3:92:7c:f7)
    Destination: Dell_92:7c:f7 (d8:9e:f3:92:7c:f7)
        Address: Dell_92:7c:f7 (d8:9e:f3:92:7c:f7)
        .... ..0. .... .... .... .... = LG bit: Globally unique address (factory default)
        .... ...0 .... .... .... .... = IG bit: Individual address (unicast)
    Source: Dell_55:40:83 (5c:26:0a:55:40:83)
        Address: Dell_55:40:83 (5c:26:0a:55:40:83)
        .... ..0. .... .... .... .... = LG bit: Globally unique address (factory default)
        .... ...0 .... .... .... .... = IG bit: Individual address (unicast)
    Type: IPv4 (0x0800)
    Padding: 000000000000
Internet Protocol Version 4, Src: 10.158.134.32, Dst: 10.158.134.5
    0100 .... = Version: 4
    .... 0101 = Header Length: 20 bytes (5)
    Differentiated Services Field: 0x00 (DSCP: CS0, ECN: Not-ECT)
        0000 00.. = Differentiated Services Codepoint: Default (0)
        .... ..00 = Explicit Congestion Notification: Not ECN-Capable Transport (0)
    Total Length: 40
    Identification: 0xe2ea (58090)
    010. .... = Flags: 0x2, Don't fragment
        0... .... = Reserved bit: Not set
        .1.. .... = Don't fragment: Set
        ..0. .... = More fragments: Not set
    ...0 0000 0000 0000 = Fragment Offset: 0
    Time to Live: 128
    Protocol: TCP (6)
    Header Checksum: 0xf683 [validation disabled]
    [Header checksum status: Unverified]
    Source Address: 10.158.134.32
    Destination Address: 10.158.134.5
Transmission Control Protocol, Src Port: 51392, Dst Port: 54321, Seq: 27, Ack: 48, Len: 0
    Source Port: 51392
    Destination Port: 54321
    [Stream index: 0]
    [Conversation completeness: Complete, WITH_DATA (31)]
    [TCP Segment Len: 0]
    Sequence Number: 27    (relative sequence number)
    Sequence Number (raw): 738756721
    [Next Sequence Number: 28    (relative sequence number)]
    Acknowledgment Number: 48    (relative ack number)
    Acknowledgment number (raw): 1681547227
    0101 .... = Header Length: 20 bytes (5)
    Flags: 0x011 (FIN, ACK)
        000. .... .... = Reserved: Not set
        ...0 .... .... = Accurate ECN: Not set
        .... 0... .... = Congestion Window Reduced: Not set
        .... .0.. .... = ECN-Echo: Not set
        .... ..0. .... = Urgent: Not set
        .... ...1 .... = Acknowledgment: Set
        .... .... 0... = Push: Not set
        .... .... .0.. = Reset: Not set
        .... .... ..0. = Syn: Not set
        .... .... ...1 = Fin: Set
            [Expert Info (Chat/Sequence): Connection finish (FIN)]
                [Connection finish (FIN)]
                [Severity level: Chat]
                [Group: Sequence]
        [TCP Flags: ·······A···F]
            [Expert Info (Note/Sequence): This frame initiates the connection closing]
                [This frame initiates the connection closing]
                [Severity level: Note]
                [Group: Sequence]
    Window: 8212
    [Calculated window size: 2102272]
    [Window size scaling factor: 256]
    Checksum: 0x58dc [unverified]
    [Checksum Status: Unverified]
    Urgent Pointer: 0
    [Timestamps]
        [Time since first frame in this TCP stream: 12.175168000 seconds]
        [Time since previous frame in this TCP stream: 6.560946000 seconds]
This is Hello version 0.0.0, a Wireshark postdissector plugin prototype

   16  12.175278 10.158.134.5 → 10.158.134.32 TCP 54 54321 → 51392 [ACK] Seq=48 Ack=28 Win=2102272 Len=0
Frame 16: 54 bytes on wire (432 bits), 54 bytes captured (432 bits) on interface \Device\NPF_{06E76EDA-507E-41DF-9258-2F74B7137C90}, id 0
    Section number: 1
    Interface id: 0 (\Device\NPF_{06E76EDA-507E-41DF-9258-2F74B7137C90})
        Interface name: \Device\NPF_{06E76EDA-507E-41DF-9258-2F74B7137C90}
        Interface description: Ethernet
    Encapsulation type: Ethernet (1)
    Arrival Time: Jun  6, 2019 13:38:14.401391000 UTC
    [Time shift for this packet: 0.000000000 seconds]
    Epoch Time: 1559828294.401391000 seconds
    [Time delta from previous captured frame: 0.000110000 seconds]
    [Time delta from previous displayed frame: 0.000110000 seconds]
    [Time since reference or first frame: 12.175278000 seconds]
    Frame Number: 16
    Frame Length: 54 bytes (432 bits)
    Capture Length: 54 bytes (432 bits)
    [Frame is marked: False]
    [Frame is ignored: False]
    [Protocols in frame: eth:ethertype:ip:tcp]
Ethernet II, Src: Dell_92:7c:f7 (d8:9e:f3:92:7c:f7), Dst: Dell_55:40:83 (5c:26:0a:55:40:83)
    Destination: Dell_55:40:83 (5c:26:0a:55:40:83)
        Address: Dell_55:40:83 (5c:26:0a:55:40:83)
        .... ..0. .... .... .... .... = LG bit: Globally unique address (factory default)
        .... ...0 .... .... .... .... = IG bit: Individual address (unicast)
    Source: Dell_92:7c:f7 (d8:9e:f3:92:7c:f7)
        Address: Dell_92:7c:f7 (d8:9e:f3:92:7c:f7)
        .... ..0. .... .... .... .... = LG bit: Globally unique address (factory default)
        .... ...0 .... .... .... .... = IG bit: Individual address (unicast)
    Type: IPv4 (0x0800)
Internet Protocol Version 4, Src: 10.158.134.5, Dst: 10.158.134.32
    0100 .... = Version: 4
    .... 0101 = Header Length: 20 bytes (5)
    Differentiated Services Field: 0x00 (DSCP: CS0, ECN: Not-ECT)
        0000 00.. = Differentiated Services Codepoint: Default (0)
        .... ..00 = Explicit Congestion Notification: Not ECN-Capable Transport (0)
    Total Length: 40
    Identification: 0x3521 (13601)
    010. .... = Flags: 0x2, Don't fragment
        0... .... = Reserved bit: Not set
        .1.. .... = Don't fragment: Set
        ..0. .... = More fragments: Not set
    ...0 0000 0000 0000 = Fragment Offset: 0
    Time to Live: 128
    Protocol: TCP (6)
    Header Checksum: 0x0000 [validation disabled]
    [Header checksum status: Unverified]
    Source Address: 10.158.134.5
    Destination Address: 10.158.134.32
Transmission Control Protocol, Src Port: 54321, Dst Port: 51392, Seq: 48, Ack: 28, Len: 0
    Source Port: 54321
    Destination Port: 51392
    [Stream index: 0]
    [Conversation completeness: Complete, WITH_DATA (31)]
    [TCP Segment Len: 0]
    Sequence Number: 48    (relative sequence number)
    Sequence Number (raw): 1681547227
    [Next Sequence Number: 48    (relative sequence number)]
    Acknowledgment Number: 28    (relative ack number)
    Acknowledgment number (raw): 738756722
    0101 .... = Header Length: 20 bytes (5)
    Flags: 0x010 (ACK)
        000. .... .... = Reserved: Not set
        ...0 .... .... = Accurate ECN: Not set
        .... 0... .... = Congestion Window Reduced: Not set
        .... .0.. .... = ECN-Echo: Not set
        .... ..0. .... = Urgent: Not set
        .... ...1 .... = Acknowledgment: Set
        .... .... 0... = Push: Not set
        .... .... .0.. = Reset: Not set
        .... .... ..0. = Syn: Not set
        .... .... ...0 = Fin: Not set
        [TCP Flags: ·······A····]
    Window: 8212
    [Calculated window size: 2102272]
    [Window size scaling factor: 256]
    Checksum: 0x217c [unverified]
    [Checksum Status: Unverified]
    Urgent Pointer: 0
    [Timestamps]
        [Time since first frame in this TCP stream: 12.175278000 seconds]
        [Time since previous frame in this TCP stream: 0.000110000 seconds]
    [SEQ/ACK analysis]
        [This is an ACK to the segment in frame: 15]
        [The RTT to ACK the segment was: 0.000110000 seconds]
        [iRTT: 0.000496000 seconds]
This is Hello version 0.0.0, a Wireshark postdissector plugin prototype

   17  12.175495 10.158.134.5 → 10.158.134.32 TCP 54 54321 → 51392 [FIN, ACK] Seq=48 Ack=28 Win=2102272 Len=0
Frame 17: 54 bytes on wire (432 bits), 54 bytes captured (432 bits) on interface \Device\NPF_{06E76EDA-507E-41DF-9258-2F74B7137C90}, id 0
    Section number: 1
    Interface id: 0 (\Device\NPF_{06E76EDA-507E-41DF-9258-2F74B7137C90})
        Interface name: \Device\NPF_{06E76EDA-507E-41DF-9258-2F74B7137C90}
        Interface description: Ethernet
    Encapsulation type: Ethernet (1)
    Arrival Time: Jun  6, 2019 13:38:14.401608000 UTC
    [Time shift for this packet: 0.000000000 seconds]
    Epoch Time: 1559828294.401608000 seconds
    [Time delta from previous captured frame: 0.000217000 seconds]
    [Time delta from previous displayed frame: 0.000217000 seconds]
    [Time since reference or first frame: 12.175495000 seconds]
    Frame Number: 17
    Frame Length: 54 bytes (432 bits)
    Capture Length: 54 bytes (432 bits)
    [Frame is marked: False]
    [Frame is ignored: False]
    [Protocols in frame: eth:ethertype:ip:tcp]
Ethernet II, Src: Dell_92:7c:f7 (d8:9e:f3:92:7c:f7), Dst: Dell_55:40:83 (5c:26:0a:55:40:83)
    Destination: Dell_55:40:83 (5c:26:0a:55:40:83)
        Address: Dell_55:40:83 (5c:26:0a:55:40:83)
        .... ..0. .... .... .... .... = LG bit: Globally unique address (factory default)
        .... ...0 .... .... .... .... = IG bit: Individual address (unicast)
    Source: Dell_92:7c:f7 (d8:9e:f3:92:7c:f7)
        Address: Dell_92:7c:f7 (d8:9e:f3:92:7c:f7)
        .... ..0. .... .... .... .... = LG bit: Globally unique address (factory default)
        .... ...0 .... .... .... .... = IG bit: Individual address (unicast)
    Type: IPv4 (0x0800)
Internet Protocol Version 4, Src: 10.158.134.5, Dst: 10.158.134.32
    0100 .... = Version: 4
    .... 0101 = Header Length: 20 bytes (5)
    Differentiated Services Field: 0x00 (DSCP: CS0, ECN: Not-ECT)
        0000 00.. = Differentiated Services Codepoint: Default (0)
        .... ..00 = Explicit Congestion Notification: Not ECN-Capable Transport (0)
    Total Length: 40
    Identification: 0x3522 (13602)
    010. .... = Flags: 0x2, Don't fragment
        0... .... = Reserved bit: Not set
        .1.. .... = Don't fragment: Set
        ..0. .... = More fragments: Not set
    ...0 0000 0000 0000 = Fragment Offset: 0
    Time to Live: 128
    Protocol: TCP (6)
    Header Checksum: 0x0000 [validation disabled]
    [Header checksum status: Unverified]
    Source Address: 10.158.134.5
    Destination Address: 10.158.134.32
Transmission Control Protocol, Src Port: 54321, Dst Port: 51392, Seq: 48, Ack: 28, Len: 0
    Source Port: 54321
    Destination Port: 51392
    [Stream index: 0]
    [Conversation completeness: Complete, WITH_DATA (31)]
    [TCP Segment Len: 0]
    Sequence Number: 48    (relative sequence number)
    Sequence Number (raw): 1681547227
    [Next Sequence Number: 49    (relative sequence number)]
    Acknowledgment Number: 28    (relative ack number)
    Acknowledgment number (raw): 738756722
    0101 .... = Header Length: 20 bytes (5)
    Flags: 0x011 (FIN, ACK)
        000. .... .... = Reserved: Not set
        ...0 .... .... = Accurate ECN: Not set
        .... 0... .... = Congestion Window Reduced: Not set
        .... .0.. .... = ECN-Echo: Not set
        .... ..0. .... = Urgent: Not set
        .... ...1 .... = Acknowledgment: Set
        .... .... 0... = Push: Not set
        .... .... .0.. = Reset: Not set
        .... .... ..0. = Syn: Not set
        .... .... ...1 = Fin: Set
            [Expert Info (Chat/Sequence): Connection finish (FIN)]
                [Connection finish (FIN)]
                [Severity level: Chat]
                [Group: Sequence]
        [TCP Flags: ·······A···F]
            [Expert Info (Note/Sequence): This frame undergoes the connection closing]
                [This frame undergoes the connection closing]
                [Severity level: Note]
                [Group: Sequence]
    Window: 8212
    [Calculated window size: 2102272]
    [Window size scaling factor: 256]
    Checksum: 0x217c [unverified]
    [Checksum Status: Unverified]
    Urgent Pointer: 0
    [Timestamps]
        [Time since first frame in this TCP stream: 12.175495000 seconds]
        [Time since previous frame in this TCP stream: 0.000217000 seconds]
This is Hello version 0.0.0, a Wireshark postdissector plugin prototype

   18  12.175647 10.158.134.32 → 10.158.134.5 TCP 60 51392 → 54321 [ACK] Seq=28 Ack=49 Win=2102272 Len=0
Frame 18: 60 bytes on wire (480 bits), 60 bytes captured (480 bits) on interface \Device\NPF_{06E76EDA-507E-41DF-9258-2F74B7137C90}, id 0
    Section number: 1
    Interface id: 0 (\Device\NPF_{06E76EDA-507E-41DF-9258-2F74B7137C90})
        Interface name: \Device\NPF_{06E76EDA-507E-41DF-9258-2F74B7137C90}
        Interface description: Ethernet
    Encapsulation type: Ethernet (1)
    Arrival Time: Jun  6, 2019 13:38:14.401760000 UTC
    [Time shift for this packet: 0.000000000 seconds]
    Epoch Time: 1559828294.401760000 seconds
    [Time delta from previous captured frame: 0.000152000 seconds]
    [Time delta from previous displayed frame: 0.000152000 seconds]
    [Time since reference or first frame: 12.175647000 seconds]
    Frame Number: 18
    Frame Length: 60 bytes (480 bits)
    Capture Length: 60 bytes (480 bits)
    [Frame is marked: False]
    [Frame is ignored: False]
    [Protocols in frame: eth:ethertype:ip:tcp]
Ethernet II, Src: Dell_55:40:83 (5c:26:0a:55:40:83), Dst: Dell_92:7c:f7 (d8:9e:f3:92:7c:f7)
    Destination: Dell_92:7c:f7 (d8:9e:f3:92:7c:f7)
        Address: Dell_92:7c:f7 (d8:9e:f3:92:7c:f7)
        .... ..0. .... .... .... .... = LG bit: Globally unique address (factory default)
        .... ...0 .... .... .... .... = IG bit: Individual address (unicast)
    Source: Dell_55:40:83 (5c:26:0a:55:40:83)
        Address: Dell_55:40:83 (5c:26:0a:55:40:83)
        .... ..0. .... .... .... .... = LG bit: Globally unique address (factory default)
        .... ...0 .... .... .... .... = IG bit: Individual address (unicast)
    Type: IPv4 (0x0800)
    Padding: 000000000000
Internet Protocol Version 4, Src: 10.158.134.32, Dst: 10.158.134.5
    0100 .... = Version: 4
    .... 0101 = Header Length: 20 bytes (5)
    Differentiated Services Field: 0x00 (DSCP: CS0, ECN: Not-ECT)
        0000 00.. = Differentiated Services Codepoint: Default (0)
        .... ..00 = Explicit Congestion Notification: Not ECN-Capable Transport (0)
    Total Length: 40
    Identification: 0xe2eb (58091)
    010. .... = Flags: 0x2, Don't fragment
        0... .... = Reserved bit: Not set
        .1.. .... = Don't fragment: Set
        ..0. .... = More fragments: Not set
    ...0 0000 0000 0000 = Fragment Offset: 0
    Time to Live: 128
    Protocol: TCP (6)
    Header Checksum: 0xf682 [validation disabled]
    [Header checksum status: Unverified]
    Source Address: 10.158.134.32
    Destination Address: 10.158.134.5
Transmission Control Protocol, Src Port: 51392, Dst Port: 54321, Seq: 28, Ack: 49, Len: 0
    Source Port: 51392
    Destination Port: 54321
    [Stream index: 0]
    [Conversation completeness: Complete, WITH_DATA (31)]
    [TCP Segment Len: 0]
    Sequence Number: 28    (relative sequence number)
    Sequence Number (raw): 738756722
    [Next Sequence Number: 28    (relative sequence number)]
    Acknowledgment Number: 49    (relative ack number)
    Acknowledgment number (raw): 1681547228
    0101 .... = Header Length: 20 bytes (5)
    Flags: 0x010 (ACK)
        000. .... .... = Reserved: Not set
        ...0 .... .... = Accurate ECN: Not set
        .... 0... .... = Congestion Window Reduced: Not set
        .... .0.. .... = ECN-Echo: Not set
        .... ..0. .... = Urgent: Not set
        .... ...1 .... = Acknowledgment: Set
        .... .... 0... = Push: Not set
        .... .... .0.. = Reset: Not set
        .... .... ..0. = Syn: Not set
        .... .... ...0 = Fin: Not set
        [TCP Flags: ·······A····]
    Window: 8212
    [Calculated window size: 2102272]
    [Window size scaling factor: 256]
    Checksum: 0x58db [unverified]
    [Checksum Status: Unverified]
    Urgent Pointer: 0
    [Timestamps]
        [Time since first frame in this TCP stream: 12.175647000 seconds]
        [Time since previous frame in this TCP stream: 0.000152000 seconds]
    [SEQ/ACK analysis]
        [This is an ACK to the segment in frame: 17]
        [The RTT to ACK the segment was: 0.000152000 seconds]
        [iRTT: 0.000496000 seconds]
This is Hello version 0.0.0, a Wireshark postdissector plugin prototype

